{"job_id":"00000000-0000-4000-8000-000000000201","job_type":"research.run","job_version":1,"tenant_context":{"workspace_id":"00000000-0000-4000-8000-000000000001","actor":{"kind":"system_actor","id":"research-worker"},"request_id":"00000000-0000-4000-8000-000000000005","correlation_id":"00000000-0000-4000-8000-000000000006","locale":"th-TH","timezone":"Asia/Bangkok"},"priority":0,"available_at":"2026-08-31T00:00:00.000Z","attempt":0,"max_attempts":3,"timeout_seconds":300,"lease_owner":"worker-1","lease_expires_at":"2026-08-31T00:05:00.000Z","dedupe_key":"research:00000000-0000-4000-8000-000000000201","input_ref":"synthetic://input/00000000-0000-4000-8000-000000000202","progress_percent":0,"progress_stage":"jobs.research.queued"}
